D827	ومع ذلك ، عانت جاكسونفيل من ظروف إعصارية أو شبه إعصارية أكثر من اثنتي عشرة مرة بسبب العواصف التي تعبر الولاية من خليج المكسيك إلى المحيط الأطلسي، أو تنطلق من المنطقة لتمر من المحيط الأطلسي إلى الشمال أو الجنوب.
D828	كان التأثير الأقوى على جاكسونفيل من إعصار دورا في عام 1964، العاصفة الوحيدة المسجلة التي ضربت منطقة فيرست كوست برياح متواصلة بقوة الإعصار.
D829	واجهت سانت أوغسطين رياحًا كنت في حدها الأدنى 110 ميل في الساعة (180 كم\ساعة)، مما يجعلها قوية "مجموعة 2" على مقياس سفير-سمبسون.
D830	كما عانت جاكسونفيل في 2008 من العاصفة المدارية فاي التي اجتاحت الولاية، مما أدى إلى تعرض أجزاء من جاكسونفيل للظلام لمدة أربعة أيام.
D831	وبالمثل - قبل أربع سنوات من ذلك - غمر جاكسونفيل إعصار فرانسيس وإعصار جين مما أدى إلى هبوط الأرض في المنطقة الشمالية.
D832	وكانت هذه الأعاصير المدارية أكثر الضربات غير المباشرة التي أصابت جاكسونفيل.
D833	تسبب إعصار فلويد في عام 1999 بأضرار كبيرة بشاطئ لجاكسونفيل.
D834	أثناء إعصار فلويد، تعرض رصيف شاطئ جاكسونفيل لأضرار جسيمة وتهدّم بعدها.
D835	تضرر الرصيف الذي أعيد بناؤه في وقت لاحق من قبل إعصار فاي، ولكن لم يتم تدميره بالكامل.
D836	وتسببت العاصفة المدارية بوني بأضرار طفيفة في عام 2004 حيث ولدت هذه العاصفة إعصارًا صغيرًا.
D837	وفي 28 مايو من عام 2012 تأثرت مدينة جاكسونفيل بالعاصفة المدارية بيريل، حيث وصلت سرعة الرياح إلى 70 ميلًا في الساعة (113 كم\ساعة) عند بلوغها اليابسة بالقرب من شاطئ جاكسونفيل.
D838	قدم الخبير الاقتصادي جوزيف ستيجليتز دليلًا في عام 2009 على أن كلا من عدم المساواة في العالم وعدم المساواة داخل البلدان تمنع النمو من خلال الحد من الطلب الكلي.
D839	كتب الاقتصادي برانكو ميلانوفيتش في عام 2001 أن "الرأي القائل بأن عدم المساواة في الدخل يضر بالنمو - أو أن المساواة المحسنة يمكن أن تساعد في الحفاظ على النمو - أصبح أكثر انتشارا في السنوات الأخيرة...
D840	إن السبب الرئيسي لهذا التحول هو الأهمية المتزايدة لرأس المال البشري في قطاع التنمية.
D841	وعندما يكون رأس المال المادي أكثر أهمية، تكون المدخرات والاستثمارات هي الحل.
D842	ويكون من المهم أن يكون هناك مجموعة كبيرة من الأثرياء الذين يمكنهم توفير نسبة أكبر من دخلهم من الفقراء واستثمارها في رأس المال المادي.
D843	ولكن الآن بعد أن أصبح رأس المال البشري نادرًا أكثر من الآلات، أصبح التعليم واسع الانتشار سر النمو.
D844	في عام 1993، أظهر غلور وزيريا أن عدم المساواة مع وجود عيوب في سوق الائتمان له تأثير ضار طويل الأمد على تكوين رأس المال البشري والتنمية الاقتصادية.
D845	بحثت دراسة قام بها بيروتي عام 1996 في القنوات التي قد يؤثر من خلالها عدم المساواة على النمو الاقتصادي.
D846	وأظهر أنه وفقًا لنهج النقص في سوق الائتمان، يرتبط عدم المساواة بانخفاض مستوى تكوين رأس المال البشري (التعليم والخبرة والتدريب المهني) وارتفاع مستوى الخصوبة وبالتالي انخفاض مستويات النمو.
D847	ووجد أن عدم المساواة يرتبط بمستويات أعلى من إعادة التوزيع الضريبي والتي ترتبط بمستويات نمو منخفضة من التخفيضات في المدخرات والاستثمارات الخاصة.
D848	وخلص بيروتي إلى أن "المجتمعات الأكثر مساواة لديها معدلات خصوبة أقل ومعدلات أعلى من الاستثمار في التعليم.
D849	وكلاهما ينعكس في ارتفاع معدلات النمو.
D850	كما تميل المجتمعات غير المتكافئة إلى أن تكون غير مستقرّة على المستوى السياسي والاجتماعي، وهو ما ينعكس في انخفاض معدلات الاستثمار وبالتالي على النمو."
D851	توصلت الدراسات التي أجريت على عدم المساواة في الدخل والنمو في بعض الأحيان إلى أدلة تؤكد فرضية منحنى كوزنتس والتي تنص على أنه من خلال التنمية الاقتصادية يكون هناك زيادة أولًا في عدم المساوة ثم يصبح هناك نقصان.
D852	يتحدى الاقتصادي توماس بيكيتي هذه الفكرة مدعيًا أنه في الفترة بين عامي 1914 و 1945 قللت الحروب و "الأزمات الاقتصادية والسياسية العنيفة" من عدم المساواة.
D853	علاوة على ذلك، يجادل بيكيتي أن فرضية منحنى كوزنتس "السحرية" - بتأكيدها على موازنة النمو الاقتصادي على المدى الطويل - لا يمكن أن تفسر الزيادة الكبيرة في التفاوت الاقتصادي في جميع أنحاء العالم المتقدم منذ سبعينيات القرن الماضي.
D854	أنشأت بعض النظريات التي تم تطويرها في سبعينيات القرن العشرين سبلًا ممكنة يمكن من خلالها أن يكون لعدم المساواة تأثيرًا إيجابيًا على التنمية الاقتصادية.
D855	وفقًا لاستعراض عام 1955، كان يُعتقد أن مدخرات الأثرياء - إذا كانت هذه الزيادة مقترنة بعدم المساواة - تعوض خفض الطلب الاستهلاكي.
D856	يشير تقرير 2013 عن نيجيريا إلى أن النمو قد ارتفع مع زيادة عدم المساواة في الدخل.
D857	ذكرت بعض النظريات الشائعة من 1950 إلى 2011 بشكل غير صحيح أن عدم المساواة كان له تأثير إيجابي على التنمية الاقتصادية.
D858	كانت التحليلات المستندة إلى مقارنة أرقام المساواة السنوية بمعدلات النمو السنوية مضللة لأن التأثيرات تستغرق عدة سنوات لتظهر كتغيرات في النمو الاقتصادي.
D859	وجد خبراء الاقتصاد في صندوق النقد الدولي وجود علاقة قوية بين انخفاض مستويات عدم المساواة في البلدان النامية وفترات النمو الاقتصادي المستمرة.
D860	لقد نجحت البلدان النامية التي تعاني من عدم مساواة عالية "في بدء النمو بمعدلات عالية لبضع سنوات "لكن" فترات النمو الطويلة ترتبط بقوة بالمزيد من المساواة في توزيع الدخل."
D861	على الرغم من الاعتراف بالدور المركزي الذي يمكن أن يلعبه النمو الاقتصادي في التنمية البشرية والحد من الفقر وتحقيق الأهداف الإنمائية للألفية، فقد أصبح من المفهوم على نطاق واسع بين مجتمع التنمية أنه يجب بذل جهود خاصة لضمان قدرة الأقسام الأكثر فقرًا في المجتمع على المشاركة في النمو الاقتصادي.
D862	يمكن أن يعتمد تأثير النمو الاقتصادي على الحد من الفقر - مرونة نمو الفقر - على المستوى الحالي من عدم المساواة.
D863	على سبيل المثال، يمكن لدولة ذات معدل نمو يبلغ 2% للفرد و ويعيش 40% من سكانها في فقر مع انخفاض معدل عدم المساواة أن تقلص الفقر إلى النصف في عشر سنوات، لكن البلد الذي يتسم بارتفاع معدلات عدم المساواة سيستغرق ما يقرب من 60 سنة لتحقيق نفس التخفيض.
D864	على حد تعبير الأمين العام للأمم المتحدة الأمم المتحدة بان كي مون.
D865	"في حين أن النمو الاقتصادي ضروري، إلا أنه لا يكفي في التقدم للحد من الفقر."
D866	نادرًا ما يسافر الدكتور وحده، وغالبًا ما يجلب واحدًا أو أكثر من المرافقين لمشاركته هذه المغامرات.
D867	عادة ما يكون رفاقه بشرًا، لأنه وجد جاذبية لكوكب الأرض.
D868	غالبًا ما يجد أحداثًا تثير فضوله أثناء محاولته منع قوى الشر من إيذاء الأبرياء أو تغيير التاريخ مستخدمًا فقط براعته والحد الأدنى من الموارد، مثل المفك الصوتي متعدد الاستخدامات.
D869	باعتباره سيدًا للوقت فإن الدكتور يمتلك القدرة على التجدد عندما يكون جسمه متأذيًا جدًا من خلال ظهوره بشخصية جديدة.
D870	اكتسب الدكتور العديد من الأعداء المتكررين خلال رحلاته، بما في ذلك الدالكس ورجال السايبر، و الماستر وهو آخر سيد الوقت المتمرد.
D871	يظهر الجزء الأول من السلسلة الطفل السماوي أن الطبيب لديه حفيدة سوزان فورمان.
D872	في سلسلة عام 1967 "مقبرة رجال السايبر" عندما تشك فيكتوريا فيلدفيلد في أن الدكتور يمكن أن يتذكر أسرته بسبب "كونه قديمًا"، يقول الدكتور إنه يستطيع ذلك عندما يريد حقًا - "بقية الوقت الذي ينامون فيه عقلي".
D873	تكشف سلسلة 2005 أن الدكتور التاسع كان يعتقد أنه آخر سيدٍ على قيد الحياة، وأن كوكبه الوطن قد تم تدميره؛ في سلسلة "الطفل الفارغ" في عام (2005)، يقول الدكتور قسطنطين، "قبل بدء الحرب، كنت أبًا وجدًا.
D874	أما الآن، فأنا لا أحد منهما."
D875	ويردّ الدكتور قائلًا "نعم، أنا أعرف هذا الشعور."
D876	في سلسلة "سميث وجونز" (2007) ، عندما سئل عما إذا كان لديه أخ، أجاب "لا، ليس بعد الآن".
D877	في كل من السلسلتين "الخوف منها" (2006) و "ابنة الطبيب" (2008)، ذكر أنه كان أبًا في الماضي.
D878	منذ إحياءه في عام 2005، يسافر الدكتور عمومًا مع مرافقة أنثى، التي تشغل دورًا أكبر في القصة.
D879	وصف ستيفن موفات المرافقة بأنها الشخصية الرئيسية في العرض، حيث تبدأ القصة من جديد مع كل مرافقة وهي تخضع للتغيير أكثر من الدكتور.
D880	المرافقون الأساسيون للأطباء التاسع والعاشر هم روز تايلر (بيلي بايبر)، مارثا جونز (فريما أجيمان)، ودونا نوبل (كاثرين تيت) مع ميكي سميث (نويل كلارك) وجاك هاركنيس (جون بارومان) مكررين كمرافقين ثانويين.
D881	أصبح الطبيب الحادي عشر أول من سافر مع زوجين متزوجين، إيمي بوند (كارين جيلان) وروري ويليامز (آرثر دارفيل)، في حين قدمت اللقاءات غير متزامنة مع ريفر سونج (أليكس كينغستون) وكلارا أوزوالد (جينا كولمان) قصصًا كثيرة مستمرة.
D882	سوف تقدم السلسلة العاشرة مشروع جوهرة ماكي المرافق الأحدث للدكتور.
D883	كان الموزع الموسيقي الأكثر شيوعًا خلال الخمسة عشر عامًا الأولى هو دودلي سيمبسون، والمعروف أيضًا بنمطه وموسيقاه العارضة بـ "بليكس 7"، وبموسيقاه البارعة والمقاطع الموسيقية للحصول على إصدار السبعينات الأصلي من "جيل الغد".
D884	كانت عمل لسيمبسون في سلسلة "دكتور هو" هو كوكب العمالقة (1964) وواصل كتابة الموسيقى للعديد من مغامرات ستينات وسبعينات القرن العشرين بما في ذلك معظم القصص في فترة جون بيرتوي\توم بيكر، لتنتهي بـ قرون نيمون في عام (1979).
D885	كما ظهر كضيف شرف في مخالب ونغ شيانغ (كقائد للفرقة الموسيقية).
D886	تم عرض سلسلة "الدكتور هو" مرات عديدة".
D887	في أوائل سبعينيات القرن العشرين، لعب تريفور مارتن دورًا في دكتور هو والدالكس في المفاتيح السبعة حتى يوم القيامة.
D888	في أواخر الثمانينات، لعب كل من جون بيرتوي وكولين بيكر دور الطبيب مرات مختلفة أثناء أداء مسرحية بعنوان الدكتور هو - المغامرة النهائية.
D889	بينما كان بيرتوي مريضًا في أداءين، قام ديفيد بانكس (المعروف بدور رجال السايبر) بدور الطبيب.
D890	تم عرض مسرحيات أصلية أخرى كعروض مسرحية للهواة شارك فيها ممثلون آخرون يلعبون دور الطبيب، بينما كتب تيري نيشن لعنة الدالكس وهي مسرحية تم تنظيمها في أواخر الستينيات ولكن دون الدكتور.
D891	﻿ كانت المباني الأولى للحرم الجامعي لجامعة شيكاغو، والتي تشكل ما يُعرف الآن باسم المربعات الرئيسية، جزءاً من "خطة رئيسية" أعدها اثنان من أمناء جامعة شيكاغو ورسمها المهندس المعماري في شيكاغو هنري إيفيس كوب.
D892	تتكون المربعات .
D893	الرئيسية من ستة مربعات، كل منها محاط بمباني، وتحد مربع أكبر.
D894	صُمِّمَت مباني المربعات الرئيسية من قبل كوب وشبلي وروتان وكوليدج وهولابيرد وروتشي وشركات معمارية أخرى في مزيج من الأساليب الفيكتورية القوطية والكوليجية، على طراز كليات جامعة أكسفورد.
D895	(برج ميتشل، على سبيل المثال، تم تصميمه على غرار برج أكسفورد ماجدلين، ومُشَاعَات الجامعة، قاعة هتشينسون، تحاكي تصميم قاعة كنيسة المسيح.)
D896	بعد أربعينات القرن الماضي، بدأ النمط القوطي في الحرم الجامعي في إفساح المجال للأساليب الحديثة.
D897	في عام 1955، تم التعاقد مع إيرو سارنين لوضع خطة رئيسية ثانية، والتي أدت إلى تشييد المباني في كل من شمال وجنوب الطريق الأوسط، بما في ذلك مربع قانون ليرد بيل (مجمع صممه سارنين)؛ سلسلة من المباني الفنية؛ مبنى صممه لودفيج ميس فان دير روه لمدرسة الجامعية لإدارة الخدمة الاجتماعية؛ وهو مبنى سيصبح مقر مدرسة هاريس لدراسات السياسة العامة من قِبَل إدوارد دوريل ستون، ومكتبة ريجنشتاين، أكبر مبنى في الحرم الجامعي، وهو هيكل وحشي صممه والتر نيتش من شركة شيكاغو سكيدمور، أوينغس وميريل.
D898	خطة رئيسية أخرى، تم تصميمها في عام 1999 وتم تحديثها في عام 2004، أنتجت مركز جيرالد راتنر لألعاب القوى (2003)، و مُشاعات بالفسكاي الداخلية (2001) وقاعة إقامة الحرم الجنوبي ومُشاعات الطعام (2009)، مستشفى أطفال جديد، وغيرها من الأبنية والتوسعات والترميمات.
D899	في عام 2011 ، أكملت الجامعة مكتبة جوي وريكا مانسيتو التي على شكل قبة زجاجية، والتي توفر غرفة قراءة كبيرة لمكتبة الجامعة وتمنع الحاجة إلى إيداع الكتب خارج الحرم الجامعي.
D900	تدير الجامعة عدداً من المؤسسات والبرامج الأكاديمية باستثناء المدارس الجامعية والدراسات العليا.
D901	هي تُشغِّل مدارس مختبرات  جامعة شيكاغو (مدرسة نهارية خاصة لطلاب المرحلة كي-12 والرعاية النهارية)، مدرسة سونيا شانكمان لتقويم العظام (برنامج علاج مُقِيم لأولئك الذين يعانون من المشاكل العاطفية والسلوكية، و أربعة مدارس مُستأجَرَة عامة على الجانب الجنوبي من شيكاغو التي يديرها معهد التعليم الحضري في الجامعة.
D902	بالإضافة إلى ذلك، تحتفظ مدرسة يوم متنزه هايدي، وهي مدرسة للطلاب ذوي صعوبات التعلم، بموقعها في حرم جامعة شيكاغو رقم.
D903	منذ عام 1983، حافظت جامعة شيكاغو على مشروع الرياضيات المدرسية بجامعة شيكاغو، وهو برنامج للرياضيات يستخدم في المدارس الابتدائية والثانوية الحضرية.
D904	تدير الجامعة برنامجاً يسمى مجلس الدراسات المتقدمة في العلوم الاجتماعية والإنسانية، والذي يدير ورش عمل متعددة التخصصات لتوفير منتدى لطلاب الدراسات العليا وأعضاء هيئة التدريس والباحثين الزائرين لتقديم العمل العلمي الجاري.
D905	تدير الجامعة أيضاً مطبعة جامعة شيكاغو، أكبر مطبعة جامعة في الولايات المتحدة.
D906	في مجال الأعمال التجارية، من بين الخريجين البارزين الرئيس التنفيذي لشركة مايكروسوفت ساتيا ناديلا ومؤسس شركة "أوراكل" وثالث أغنى رجل في أمريكا لاري إليسون وجولدمان ساكس والرئيس التنفيذي ل"إم إف جلوبال" وكذلك حاكم نيوجرسي السابق جون كورزين، مؤسس شركة "ماكينزي وشركاؤه" ومؤلف أول كتاب تدريبي للمحاسبة الإدارية جيمس أو.
D907	ماكينزي وأرلي د.
D908	كاثي والرئيس التنفيذي ل"بلومبيرج إل.
D909	بي”.
D910	دانييل دكتوروف والرئيس التنفيذي لبنك كريدي سويس برادي دوغان والمؤسس والمدير التنفيذي لشركة مورنينج ستارجو مانسويتو ومالك ورئيس "شيكاغو كوبس" توماس إس ريكيتس ومُفَوَّض الرابطة الوطنية لكرة السلة آدم سيلفر.
D911	في الاقتصاد، الفائزون بجائزة نوبل التذكارية في العلوم الاقتصادية ميلتون فريدمان، مستشار رئيسي للرئيس الأمريكي الجمهوري رونالد ريغان ورئيسة الوزراء البريطانية المحافظة مارغريت تاتشر وجورج ستيجلر، الحائز على جائزة نوبل والمؤيد لنظرية الالتقاط التنظيمي وغاري بيكر، أحد المُساهِمِين المهمين في فرع الاقتصاد الأسري للاقتصاد وهربرت أ.
D912	سيمون، المسؤول عن التفسير الحديث لمفهوم صنع القرار التنظيمي وبول سامويلسون، أول أمريكي يفوز بجائزة نوبل التذكارية في العلوم الاقتصادية ويوجين فاما، والمعروف عن عمله في نظرية المحفظة، تسعير الأصول وسلوك سوق الأسهم، وجميعهم من الخريجين.
D913	الاقتصادي الأمريكي والنظري الاجتماعي والفيلسوف السياسي والمؤلف توماس سويل هو أيضا من الخريجين.
D914	واجهت حكومة كوبلاي صعوبات مالية بعد 1279.
D915	كانت الحروب ومشاريع البناء قد استنزفت الخزينة المغولية.
D916	الجهود المبذولة لرفع وجمع إيرادات الضرائب ابتليت بالفساد والفضائح السياسية.
D917	البعثات العسكرية الخاطئة تبعت المشاكل المالية.
D918	فشل غزو كوبلاي الثاني لليابان في عام 1281 بسبب إعصار مشؤوم.
D919	فاشل كوبلاي حملاته ضد أنام وتشامبا وجافا، لكنه حقق فوزاً باهظاً ضد بورما.
D920	أعيقت الحملات بسبب المرض  والمناخ غير المضياف والتضاريس الاستوائية غير المناسبة للحرب التي شنت على المغول.
D921	سلالة سلالة تران التي حكمت أنام (داي فييت) سحقت المغول وهزمتهم في معركة من BáÄ�ch Ä�áº ± ng (1288).
D922	كانت منطقة "فوجيان" الصينية هي الموطن الأصلي لعشيرة تران الصينية (تشن) قبل أن يرحلوا تحت ترانشن كينه (é ™ ³äº¬ ، ChÃ © n JÄ «ng) Ä�áº¡i Viá»‡t إلى داي فييت والذين أسس أحفادهم أسرة تران التي حكمت فيتنام على فياتشي »، ولا يزال بإمكان بعض أفراد العشيرة التحدث باللغة الصينية كما حدث عندما عقد مبعوث من أسرة يوان مقابلة مع أمير Tráº§n الناطق باللغة الصينية Tráº§n Quá» (n (فيما بعد الملك Tráº§n HÆ ° ng Ä�áº¡o) في 1282.
D923	أشار البروفيسور ليام كيلي إلى أن أشخاصاً من سلالة سونغ الصين مثل زهاو زهونج وشو زونغداو فروا إلى سلالة تران التي حكمت فيتنام بعد الغزو المغولي لسونج وساعدوا في حرب تران ضد الغزو المغولي.
D924	نشأت أسرة تران من منطقة فوجيان في الصين كما فعل رجل الدين الداويست شو زونغداو الذي سجل الغزو المغولي وأشار إليهم باسم "العصابات الشمالية".
D925	اعترف أنام وبورما وشامبا بهيمنة المغول وأقاموا علاقات رافدية مع أسرة يوان.
D926	حكم الإمبراطور جيجين خان، نجل أيورباروادا وخَلَفُه، لمدة عامين فقط، من 1321 إلى 1323.
D927	واصل سياسات والده لإصلاح الحكومة على أساس المبادئ الكونفوشيوسية، بمساعدة مستشاره الكبير المُعَيَّن حديثاً باجيو.
D928	خلال فترة حكمه، دا يوان تونغ زهي (الصينية: å¤§å… €é € šåˆ¶، " المؤسسات الشاملة ليوان العظيم") ،مجموعة ضخمة من رموز وأنظمة أسرة يوان بدأت من قِبَل والده، تم إصدارها رسميا.
D929	اغتيل جيجين في انقلاب شارك فيه خمسة من الأمراء من فصيل منافس، وربما نخبة من السهوب عارضت الإصلاحات الكونفوشيوسية.
D930	وضعوا YesÃ¼n TemÃ¼r (أو تايدنجدي) على العرش، و، بعد محاولة فاشلة لتهدئة الأمراء، فقد استسلم أيضاً لقتله.
