D597	تم دعم الشبكة أيضًا في أوائل الثمانينيات باستمرار نجاح مسلسلات هابي دايز وثريز كومباني و لافيرن أند شيرلي وفانتاسي آيلاند، كما اكتسبت نجاحات جديدة من تو كلوس فور كومفورت وبينسون المتفرع من سوب و مورك أند ميندي المتفرع من هابي دايز.
D598	في عام 1981 أطلقت أيه بي سي (من خلال قسم خدمات فيديو أيه بي سي التابع لها) محطة ألفا ريبيرتوري تيليفيجن سيرفس (ARTS) وهي محطة كابل تعمل كمشروع مشترك مع شركة هيرست، تقدم برامجاً ثقافية وفنية تم بثها كخدمة ليلية في محل محطة نيكلوديون.
D599	﻿‏كما رُتِّب سابقًا من قبل والده، تزوج تيموجين من بورته من قبيلة الأونجيرات عندما كان في سن السادسة عشر وذلك لتدعيم التحالفات بين قبيلتيهما.
D600	وبعد فترة وجيزة من زواج بورته من تيموجين، تم اختطافها من قبل من قبل المركيتيين وتفيد التقارير بأنه تم منحها كزوجة.
D601	بعد ذلك أنقذها تيموجين بمساعدة صديقه ومنافسه المستقبلي جاموقا وحاميته طغرل خان من قبيلة كيراتي.
D602	ثم أنجبت ولدًا بعد تسعة أشهر وسموه يوتشي (1185 - 1226) الأمر الذي ألقى بظلاله على قضية نسبه.
D603	على الرغم من التكهنات حول يوتشي، فإن بورتي كانت الإمبراطورة الوحيدة لدى تيموجين، على الرغم من أنه اتبع التقاليد من خلال اتخاذ عدة زوجات.
D604	‏بعد أن تفرق الصديقان جاموقا وتيموجين، بدأ كل منهما بتعزيز قوته وأصبحا خصمين بعد فترة وجيزة.
D605	حيث دعم جاموقا الطبقة الأرستقراطية المنغولية التقليدية، بينما اتبع تيموجين مبدأ الاستحقاق وجذب مجموعة واسعة من المؤيدين من الطبقة الدنيا.
D606	بسبب هزيمته للمركيتيين في وقت مبكر وتصريح الشامان كوكوشو أن السماء الزرقاء الخالدة قد خصت تيموجين بحكم العالم، بدأ تيموجين بالصعود إلى السلطة.
D607	وفي عام 1186 تم انتخاب تيموجين كخان للمغول.
D608	وبعد التهديد الذي واجهه بعد الارتقاء السريع لتيموجين، تحرك جاموقا بسرعة لوقف طموحاته.
D609	وفي عام 1187، شن هجومًا على صديقه السابق بجيش يتكون من ثلاثين ألف جندي.
D610	جمع تيموجين أتباعه على عجل للدفاع ضد الهجوم، لكنه هُزم هزيمة نكراء في معركة دالان بالزهوت.
D611	روّع جاموقا الناس بشدة وشوه صورته من خلال غلي سبعين شابًا من الأسرى على قيد الحياة في مرجل، مما أدى إلى نفور العديد من أتباعه المحتملين واستثارة التعاطف مع تيموجين.
D612	تم نفي طغرل إلى الدولة القراخطائية بكونه موالٍ لتيموجين.
D613	وكانت حياة تيموجين على مدار العشر سنوات التالية غير واضحة أبدًا، حيث كانت السجلات التاريخية ملغية تمامًا في تلك الفترة.
D614	‏في عام 1939، أخذ الجنود القوميون الصينيون الجثمان من موقعه في "ضميمة الرب" (بالمنغولية: إيدسين خورو) في منغوليا لحمايته من القوات اليابانية.
D615	تم نقله عبر الأراضي التي يسيطر عليها الشيوعيون في يانان على بعد حوالي 900 كم بالعربات حتى يبقى في مأمن دير بوذي هو دير دونغشان دافو ديان، حيث بقي هناك لمدة عشر سنوات.
D616	في عام 1949، ومع تقدم القوات الشيوعية، نقله الجنود القوميون لمسافة 200 كم إضافية نحو أقصى الغرب إلى دير التبت الشهير دير كومبوم أو طائر شي بالقرب من شينينغ، التي وقعت بعد ذلك بفترة وجيزة تحت سيطرة الشيوعيين.
D617	وفي أوائل عام 1954 تم إعادة جثمان جنكيز خان والآثار التابعة له إلى "ضميمة الرب" في منغوليا.
D618	وبحلول عام 1956، أقيم معبد جديد هناك لإيوائها.
D619	في عام 1968 وأثناء الثورة الثقافية، دمر الحرس الأحمر كل شيء ذي قيمة تقريبًا.
D620	تم إعادة تشكيل "الآثار" في سبعينيات القرن العشرين وتم الانتهاء من بناء تمثال رخامي رائع لجينكيز في عام 1989.
D621	‏على عكس الاعتقاد الشائع، لم يغزُ جنكيز خان جميع المناطق التي كانت في النهاية جزءًا من الإمبراطورية المغولية.
D622	فعند وفاته امتدت الإمبراطورية المغولية من بحر قزوين إلى بحر اليابان.
D623	حيث استمر توسع الإمبراطورية لجيل أو أكثر بعد وفاة جنكيز في عام 1227.
D624	ووصلت سرعة التوسع إلى ذروتها بقيادة أوقطاي خان خليفة جنكيز.
D625	اندفعت الجيوش المغولية إلى بلاد فارس، وسيطرت على كل من شيا الغربية وبقايا سلالة الخوارزميين، واشتبكت مع أسرة سونغ الإمبراطورية في الصين، وبدأت حربًا استمرت حتى عام 1279 وانتهت بسيطرة المغول على كامل أرجاء الصين.
D626	كما أنها توغلت أيضًا داخل الأراضي الروسية وأوروبا الشرقية.
D627	‏تسببت غزوات بغداد وسمرقند وأورقنج وكييف وفلاديمير وغيرها في عمليات قتل جماعية، كما حدث عندما دُمرت أجزاء من جنوب خوزستان بالكامل.
D628	ودمّر خلفه هولاكو خان الجزء الأكبر من الجزء الشمالي من إيران ونهب بغداد على الرغم من إيقاف قواته من قبل المماليك في مصر، ولكن خلف هولاكو غازان خان ستعود إلى لتطرد المماليك المصريين من بلاد الشام وفلسطين وحتى غزة.
D629	وفقا لأعمال المؤرخ الفارسي رشيد الدين الهمذاني، قتل المغول أكثر من 70,000 شخص في مرو وأكثر من 190,000 شخص في نيسابور.
D630	وفي عام 1237 قام باتو خان حفيد جنكيز خان بغزو في روس الكييفية.
D631	على مدار ثلاث سنوات، قام المغول بتدمير وإبادة جميع المدن الرئيسية في أوروبا الشرقية باستثناء نوفغورود وبسكوف.
D632	‏يعتبر فني الصيدلة في المملكة المتحدة أخصائي رعاية صحية وغالبًا لا يعمل تحت إشراف مباشر من صيدلي (إذا كان يعمل في صيدلية في المستشفى) ولكن بدلًا من ذلك يتم الإشراف عليه وإدارته من قبل فنيي صيدلة كبار السن.
D633	نمى دور فنيي الصيدلة في المملكة المتحدة وتم نقل المسؤولية إليهم لإدارة قسم الصيدلة والمجالات المتخصصة في ممارسة الصيدلة مما يتيح للصيادلة الوقت للتخصص في مجالاتهم التخصصية حيث يقضي مستشارو الأدوية المزيد من وقت العمل مع المرضى وفي البحث.
D634	يجب أن يسجل فني الصيدلة كأخصائي في سجل الهيئة الصيدلية العامة حال تأهيله.
D635	وتعتبر الهيئة الصيدلية العامة الهيئة الحاكمة لأخصائيي الرعاية الصحية الصيدلية وذلك الذي ينظم ممارسة الصيادلة وفنيي الصيدلة.
D636	‏أدى التقدم المحرز في الشرق الأوسط في علم النبات والكيمياء في الإسلام في العصور الوسطى إلى تطوير علم الصيدلة بشكل كبير.
D637	فعلى سبيل المثال، عمل محمد بن زكريا الرازي (865–915) على تعزيز الاستخدامات الطبية للمركبات الكيميائية.
D638	وكان كان أبو القاسم الزهراوي (936–1013) رائدًا في تحضير الأدوية بالتسامي والتقطير.
D639	ولكتابه "لايبر سيرفيتوريس" أهمية خاصة لأنه يزود القارئ بوصفات علاجية ويشرح كيفية تحضير "المركبات البسيطة" التي ضاعفت من عدد العقاقير المعقدة المستخدمة عمومًا.
D640	كان صابر بن سهل (توفي عام 869) أول طبيب يشرع في دستور الأدوية، حيث وصف مجموعة كبيرة ومتنوعة من الأدوية وعلاجات الأمراض.
D641	كتب البيروني (973-1050) واحدًا من أكثر الأعمال الإسلامية قيمة في علم الصيدلة بعنوان "كتاب الصيدلة"، والذي شرح فيه خصائص العقاقير وشرح دور الصيدلية ووظائفها وواجبات الصيدلي.
D642	ووصف ابن سينا أيضًا ما لا يقل عن 700 مستحضر بالإضافة إلى وخصائصها وطرق عملها ومؤشراتها.
D643	لقد كرس في الواقع مجلدًا كاملًا للعقاقير البسيطة في موسوعة القانون في الطب.
D644	كان لأعمال المارديني في بغداد والقاهرة وابن وافد (1008–1074) تأثير كبير أيضًا، وكلاهما مطبوعان باللاتينية أكثر من خمسين مرة، ويظهران باسم "Medicineis universalibus et specialibus" من تأليف "ماسويه الأصغر".
D645	و "Medicamentis simplicibus" من تأليف "ابن وافد".
D646	قام بييترو دابانو (1250-1316) بترجمة وإضافة ملحق لعمل المارديني تحت عنوان "De Veneris”.
D647	كما أن مساهمات الموفق بالله في هذا المجال رائدة أيضًا.
D648	عاش في القرن العاشر وكتب أسس الخصائص الحقيقية للعلاجات، من بين أمور أخرى تصف أكسيد الزرنيخ، وتساعد على التعرف على حامض السيليسيك.
D649	قام بتمييز واضح بين كربونات الصوديوم وكربونات البوتاسيوم ولفت الانتباه إلى الطبيعة السامة لمركبات النحاس وخاصة زاج النحاس، بالإضافة إلى مركبات الرصاص.
D650	كما يصف كيفية تقطير مياه البحر للشرب.[
D651	التحقق مطلوب]
D652	‏تخضع المستوصفات في معظم البلدان للتشريعات الصيدلية، وفقاً للاحتياجات المتعلقة بشروط التخزين والنصوص الإلزامية والتجهيزات وغيرها، كما هو محدد في هذه التشريعات.
D653	حيث أنه بمجرد أن تكون الحالة أن يبقى الصيادلة داخل المستوصفات المضاعفة\التي توزع الأدوية، كان هناك اتجاه متزايد نحو استخدام فنيي الصيدلة المدربين بينما يقضي الصيدلاني المزيد من الوقت في التواصل مع المرضى.
D654	يعتمد فنيو الصيدلة الآن على الأتمتة لمساعدتهم في دورهم الجديد في التعامل مع وصفات المرضى وقضايا سلامة المرضى.
D655	‏تركز الممارسة الصيدلانية الاستشارية على مراجعة النظم العلاجية (كالخدمات الإدراكية) أكثر من التركيز على الصرف الفعلي للأدوية.
D656	عادةً ما يعمل الصيادلة الاستشاريون في دور رعاية المسنين، ولكنهم يوسعون دائرة نشاطاتهم بشكل متزايد إلى مؤسسات أخرى وأماكن غير مؤسسية.
D657	عادةً ما كان الصيادلة الاستشاريون التقليديون أصحاب أعمال مستقلين، على الرغم من أن الكثير منهم يعملون الآن في الولايات المتحدة لصالح العديد من شركات إدارة الصيدليات الكبيرة (بخاصة أومني كير وكينديرد هيلث كير وفارميريكا).
D658	إن هذا الاتجاه ينعكس تدريجيًا حيث يبدأ الصيادلة الاستشاريون في العمل مباشرة مع المرضى، وذلك لأن كثير من المسنين يتناولون الآن العديد من الأدوية ولكنهم يستمرون في العيش خارج الأوساط المؤسسية.
D659	تقوم بعض الصيدليات المجتمعية بتوظيف صيادلة استشاريين و\أو تقديم الخدمات الاستشارية.
D660	‏في معظم السلطات القضائية (مثل: الولايات المتحدة) يتم تنظيم الصيادلة بشكل منفصل عن الأطباء.
D661	عادةً ما تحدد هذه السلطات القضائية أن الصيادلة فقط هم من يجوز لهم أن يقوموا بتزويد المستحضرات الصيدلانية المجدولة للناس، وأنه لا يحق للصيادلة تكوين شراكات تجارية مع الأطباء أو منحهم "إتاوات".
D662	ومع ذلك، تنص المدونة الأخلاقية لدى الجمعية الطبية الأمريكية على أنه يجوز للأطباء الاستغناء عن العقاقير ضمن ممارسات مكتبهم طالما لم يكن هناك أي استغلال للمريض وللمرضى الحق في وصفة طبية مكتوبة يمكن ملؤها في أي مكان آخر.
D663	ويقال إن 7 إلى 10 في المئة من الأطباء الأمريكيين يوزعون الأدوية بأنفسهم.
D664	‏يمكن أن تؤدي اضطرابات الجهاز المناعي إلى أمراض المناعة الذاتية، والأمراض الالتهابية والسرطان.
D665	يحدث نقص المناعة عندما يكون الجهاز المناعي أقل نشاطًا من المعتاد، مما يؤدي إلى الالتهابات القاتلة المتكررة أو المميتة.
D666	يمكن أن يكون نقص المناعة عند البشر إما نتيجة لمرض وراثي مثل عوز المناعة المشترك الشديد، أو الحالات المكتسبة مثل فيروس عوز المناعة المكتسب\الأيدز، أو كنتيجة لاستخدام الأدوية المثبطة للمناعة.
D667	في المقابل، فإن المناعة الذاتية ناتجة عن نظام مناعي مفرط النشاط يهاجم الأنسجة الطبيعية كما لو كانت أجسامًا غريبة.
D668	تشمل أمراض المناعة الذاتية الشائعة التهاب الغدة الدرقية الحاد والتهاب المفاصل الروماتويدي وداء السكري من النمط الأول والذئبة الحمامية الشاملة.
D669	يشمل علم المناعة دراسة جميع جوانب الجهاز المناعي.
D670	‏غالبا ما تستخدم الأدوية المضادة للالتهابات للسيطرة على آثار الالتهاب.
D671	وتعتبر الهرمونات القشرية السكرية أقوى هذه الأدوية.
D672	ومع ذلك، يمكن أن يكون لهذه الأدوية العديد من الآثار الجانبية غير المرغوب فيها، مثل السمنة المركزية وارتفاع السكر في الدم وهشاشة العظام، لذا يجب التحكم في استخدامها بدقة.
D673	غالبًا ما يتم استخدام جرعات أقل من العقاقير المضادة للالتهاب مقترنة مع أدوية قاتلة للخلايا أو مثبطة للمناعة مثل الميثوتركسات أو الآزاثيوبرين.
D674	تمنع الأدوية القاتلة للخلايا الاستجابة المناعية عن طريق قتل الخلايا المنقسمة مثل الخلايا التائية المنشّطة.
D675	ومع ذلك، فإن هذا القتل عشوائي وذلك قد يؤثر على الخلايا المنقسمة باستمرار وأعضائها، مما يسبب آثار جانبية سامة.
D676	الأدوية المثبطة للمناعة مثل السيكلوسبورين تمنع الخلايا التائية من الاستجابة للإشارات بشكل صحيح عن طريق تثبيط مسارات تحويل الإشارة.
D677	‏في المقابل، تبلغ الخلايا المتمايزة الفاعلة ذروتها خلال فترات النشاط، مثل الخلايا القاتلة الطبيعية القاتلة للخلايا والخلايا اللمفاوية التائية القاتلة للخلايا، من أجل الحصول على استجابة فعالة ضد مسببات الأمراض المتطفلة.
D678	كذلك خلال أوقات النشاط، تبلغ الجزيئات المضادة للالتهابات مثل الكورتيزول والكاتيكولامينات ذروتها.
D679	هناك نوعان من النظريات حول سبب اقتصار الحالة المؤيدة للالتهابات على أوقات النوم.
D680	أولًا: قد يسبب الالتهاب إعاقات معرفية وجسدية خطيرة إذا حدث ذلك أثناء أوقات الاستيقاظ.
D681	ثانيًا: قد يحدث التهاب أثناء أوقات النوم بسبب تواجد الميلاتونين.
D682	يسبب الالتهاب قدرًا كبيرًا من الإجهاد التأكسدي ووجود الميلاتونين في أوقات النوم يمكن أن يقاوم بفعالية إنتاج الجذور الحرة خلال هذا الوقت.
D683	‏حدث تطور في الجهاز المناعي التكيفي في سلف الفقاريات الفكية.
D684	يوجد الكثير من الجزيئات التقليدية في الجهاز المناعي التكيفي (على سبيل المثال: الغلوبولين المناعي ومستقبلات الخلايا التائية) لدى الفقاريات الفكية فقط.
D685	ومع ذلك، تم اكتشاف جزيء متميز مشتق من الخلايا اللمفاوية في الفقاريات البدائية اللافكية، مثل مصاصات الحجر والأسماك المخاطية.
D686	تمتلك هذه الحيوانات مجموعة كبيرة من الجزيئات تسمى مستقبلات الخلايا اللمفاوية المتغيرة والتي - مثل المستقبلات المضادة في الفقاريات الفكية - يتم إنتاجها من عدد صغير (واحد أو اثنين) من المورثات فقط.
D687	ويعتقد أن هذه الجزيئات تربط مولدات المضادات المسببة للأمراض بطريقة مماثلة للأجسام المضادة، وبنفس درجة الدقة.
D688	‏إن الآليات المستخدمة لتجنب الجهاز المناعي التكيفي أكثر تعقيدًا.
D689	أبسط طريقة منها هي تغيير الحلقات غير الضرورية (الأحماض الأمينية و\أو السكريات) على سطح العامل الممرض بسرعة، مع إبقاء الحلقات الأساسية غائبة.
D690	وهذا ما يسمى تباين المستضدات.
D691	وأكبر مثال على ذلك فيروس عوز المناعة المكتسب الذي يتحور بسرعة، وبالتالي فإن البروتينات الموجودة على غلافه الفيروسي والتي تعتبر ضرورية للدخول إلى الخلية المستهدفة للمضيف تتغير باستمرار.
D692	هذه التغييرات المتكررة في المستضدات قد تفسر فشل اللقاحات الموجهة للقضاء على هذا الفيروس.
D693	يستخدم طفيلي المثقبية البروسية استراتيجية مماثلة، حيث يغير باستمرار نوعًا من البروتين السطحي إلى نوع آخر، مما يسمح له بالبقاء متقدمًا بخطوة عن استجابة الجسم المضاد.
D694	يعد إخفاء المستضدات مع جزيئات المضيف استراتيجية أخرى شائعة لتجنب اكتشافها من قبل الجهاز المناعي.
D695	في فيروس عوز المناعة المكتسب، يتكون الغلاف الذي يغطي الفيروس من الغشاء الخارجي للخلية المضيفة؛ تصعّب مثل هذه الفيروسات "المخفية ذاتياً" على الجهاز المناعي التعرف عليها على أنها هياكل "غير ذاتية".
D696	‏في أعقاب مذبحة بيترلو في عام 1819، كتب الشاعر بيرسي شيلي القصيدة السياسية "قناع الفوضى" في وقت لاحق من ذلك العام، والتي تبدأ مع صور ما يعتقد أنه أشكال غير عادلة للسلطة من زمانه، ثم يتخيل التحركات نحو شكل جديد من أشكال العمل الاجتماعي.
D697	ربما تكون أول عبارة [غامضة] حديثة عن مبدأ المظاهرات السلمية.
D698	قام المؤلف هنري ديفد ثورو بنسخها في مقالته "العصيان المدني"، ثم في وقت لاحق اقتبس منها غاندي في عقيدة ساتياغراها.
D699	تأثرت فلسفة غاندي ساتياغراها جزئياً واستلهمت من أفكار شيلي في التظاهرات السلمية والعمل السياسي.
D700	ومن المعروف خصوصًا أن غاندي كان يقتبس غالبًا من قصيدة قناع الفوضى لشيلي لجماهير واسعة خلال حملته للحصول على هند حرة.
D701	العصيان المدني غير الثوري هو عصيان بسيط للقوانين على أساس أن يتم الحكم عليها بطريقة "خاطئة" من قبل ضمير الفرد، أو كجزء من محاولة لإصدار قوانين معينة غير فعالة لإلغائها، أو ممارسة الضغط للحصول على الرغبات السياسية لأحد الأشخاص في بعض القضايا الأخرى.
D702	أما العصيان المدني الثوري فهو هو أكثر من محاولة نشطة للإطاحة بالحكومة (أو لتغيير التقاليد الثقافية والعادات الاجتماعية والمعتقدات الدينية وما إلى ذلك.
D703	حيث لا تكون الثورة سياسية، أي تكون "ثورة ثقافية"، فهي تعني ببساطة تغييرًا واسعًا وواسع النطاق لقسم من النسيج الاجتماعي).
D704	وبذلك وصفت أعمال غاندي بأنها عصيان مدني ثوري.
D705	لقد زُعم أن المجريين بقيادة فيرنس دياك كانوا يوجهون العصيان المدني الثوري ضد الحكومة النمساوية.
D706	كتب ثورو أيضًا عن العصيان المدني الذي حقق "ثورة سلمية".
D707	حدد هوارد زين وهارفي ويلر وغيرهم الحق الذي تم تبنيه في إعلان الاستقلال بـ "تغيير أو إلغاء" حكومة ظالمة لتكون مبدأ العصيان المدني.
D708	‏إن بعض أشكال العصيان المدني مثل: المقاطعة غير القانونية و رفض دفع الضرائب ومشاريع التهرب والهجمات الموزعة لتعطيل تقديم الخدمة والاعتصامات تجعل الأمر أكثر صعوبة فيما يتعلق بعمل النظام.
D709	وبهذه الطريقة، يمكن اعتبارها قسرية.
D710	يلاحظ براونلي أنه "على الرغم من أن العصاة المدنيين مقيدين في استخدامهم للعنف من خلال هدفهم الضميري للدخول في حوار أخلاقي، إلا أنهم قد يجدون أنه من الضروري استخدام العنف المحدود من أجل الوصول إلى النقاش".
