D316	وقد تم إصدار بعض التنقيحات البسيطة بين ستينيات وسبعينيات القرن الماضي، في حين تم التوقيع على الاتفاقيات الكبرى المنقِّحة لإنهاء تطوير السوق داخلية وحيدة عبر قانون الأوروبي الوحدوي سنية 1986، ولتعزيز تنمية الوسط الاجتماعي الأوروبي من خلال معاهدة أمستردام سنة 1997، وللقيام بتنقيحات بسيطة في شأن سلطة الدول الأعضاء في مؤسسات الاتحاد الأوروبي من خلال معاهدة نيس سنة 2001 ومعاهدة لشبونة سنة 2007.
D317	انضمّت المزيد من الدول الأعضاء إلى الاتحاد الأوروبي منذ تأسيسه، وذلك من خلال معاهدات انضمام متتالية، بدأً بالمملكة المتّحدة، وأيرلندا، والدانمرك، والنرويج، في سنة 1972 (مع أن النرويج لم تنضمّ في النهاية)، واليونان سنة 1979، وإسبانيا والبرتغال سنة 1985، وأستراليا، وفنلندا، والنرويج، والسويد في سنة 1994 (مع أن النرويج أخفقت مجددا في الانضمام لقلة الدعم في الاستفتاء الشعبي)، وجمهورية التشيك، وسيبيريا، وإستونيا، وهنغاريا، ولاتيفيا، وليتوانيا، ومالطا، وسلوفاكيا، وسلوفينيا في سنة 2004، ورومانيا وبلغاريا في سنة 2007 وكرواتيا في سنة 2013.
D318	أما غرينلاند، فقد وقَّعت معاهدةً في سنة 1985 تمنحها منزلةً قانونيةً خاصة.
D319	تمتلك المفوضية الأوروبية السلطة لسنّ القوانين، في حين يمتلك البرلمان الأوربي ومجلس الاتحاد الأوروبي السلطة لإصدار التنقيحات والحقّ في الرفض أثناء عملية سن القوانين.
D320	استِناداً إلى الفصلين 9 و10 من معاهدة الاتحاد الأوروبي، فإن هذا الأخير يراقب "مبدأ المساواة بين مواطنيه" وينبغي تأسيسه على "الديمقراطية النيابية".
D321	تُعتَبر المساواة والديمقراطية ناقصتان من الناحية التطبيقية، لأنه النواب المنتَخَبين في البرلمان ليس بوسعهم التقدم بقوانين تنافي رغبات المفوضية الأوروبية، كما للمواطنين بالدول الصغرى وزناً انتخابياً بالبرلمان يفوق بنسبة عشرة أضعافٍ وزنَ المواطنين بالدول الكبرى مع "الأغلبية المؤهلة" أو إجماع المجلس اللازم أثناء العمليات التشريعية.
D322	ولعل سبب هذا "الخلل الديمقراطي" طبقاً لهذه المعاهدات هو أن إدماج المؤسسات الاقتصادية والاجتماعية الأوروبية استلزمت التعاون الفني من فبل الخبراء، في حين أن الفهم الشعبي لتطور الاتحاد الأوروبي وللشعور بالقومية قد تراجع عقب الحرب.
D323	وقد اتّسم البرلمان بقوة في الرأي على مر الزمن، فمن كونه مجموعة غير هامة إلى انتخاباته المباشرة الأولى في سنة 1979، وحتى حيازته المتزايدة لصلاحيات في العملية تشريعية.
D324	وبذلك صارت حقوق المواطنين محدودةً مقارنةً بالحكومات الديمقراطية بجميع الدول الأعضاء بالاتحاد الأوروبي: وطبقا للفصل 11 من معاهدة تشكيل الاتحاد الأوروبي، فإن للمواطنين والجمعيات الحقَّ في الإعلان عن آرائهم وتقديم مبادرة ينبغي المصادقة عليها من قبل المفوضية الأوروبية بمليون توقيع.
D325	كما يتضمن الفصل 227 من معاهدة تشكيل الاتحاد الأوروبي حقّاً آخر للمواطنين وهو تقديم العرائض للبرلمان حول المشاكل التي تطرأ عليهم.
D326	تجري الانتخابات البرلمانية كل خمس سنوات، ويتم تنظيم الأصوات لفائدة أعضاء البرلمان الأوروبي حسب النيابة التناسبية أو بصوت واحد قابل للنقل.
D327	يوجد 750 عضواً بالبرلمان وأعدادهم "متناسبة بشكل متناقص" مع حجم الدولة العضو.
D328	هذا يعني أن المواطنين بالدول الصغيرة لديهم أصوات أكثر من المواطنين بالدول الكبيرة، رغم أنه يتعين على المجلس أن يكون كياناً يمثل الدول الأعضاء.
D329	ينقسم أعضاء البرلمان الأوروبي على طول الخطوط السياسية، كما يفعلون في البرلمانات القومية: يعدّ حزب الشعب الأوروبي المحافظ الأكبر حالياً، أما حزب الاشتراكيين الأوروبيين فهو يتصدّر المعارضة.
D330	لا تتقى الأحزاب التمويل العمومي من الاتحاد الأوروبي، فقد أقرّت محكمة العدل الحزب الإيكولوجي "الخُضْر" في البرلمان أن هذا كان إشكالا لا تعالجه غير الدول الأعضاء.
D331	وتشمل صلاحيات البرلمان إجراء تحقيقات بشأن سوء الإدارة أو تعيين مفوض الشعب في انتظار رفع دعاوى قضائية بالمحكمة.
D332	كما يمكن أن تلزم المفوضية بالإجابة عن أسئلة ما، ويمكنها عن طريق أغلبية الثلثين وضع رقابة على كل المفوضية (كما حصل مع مفوضية سانتر سنة 1999).
D333	للبرلمان حقوق استشارية واضحة في بعض الحالات تستوجب مراعاتها الكاملة من قبل المفوضية.
D334	لكن دورها في المشاركة في سن القوانين لا يزال محدودا إذ ليس بإمكان أي عضو إجازة أي تشريع دون المفوضية ومجلس الشورى، مما يعني أن السلطة ("كراتيا") ليست في أيدي النواب الشعب ("ديموس") المنتخَبين بشكل مباشر: كون "الإدارة بأيدي الكثرة وليس القلة" لا يزال غير صحيح بعد في الاتحاد الأوروبي.
D335	عمل الاتحاد الأوروبي من تأسيسه على زيادة عدد الأنظمة القانونية على الصعيدين الوطني والعالمي.
D336	مما يعني أن كل من محكمة العدل الأوروبية والمحكمة العليا الوطنية قامتا بتطوير مبادئ لحل النزاعات القانونية بين الأنظمة.
D337	فحتى داخل الاتحاد الأوروبي، كان رأي محكمة العدل أنه لو تعارض قانون الاتحاد الأوروبي مع بند من القانون الوطني، فعندها يكون القانون الأوروبي ذو أفضلية.
D338	ففي القضية الكبرى الأولى في سنة 1964، بين كوستا والمحامي إينل من ميلانو الذي كان مساهما سابقا في شركة للطاقة، قال بأن السيد كوستا رفض أن يدفع له فاتورة الكهرباء كضرب من الاحتجاج على تأميم الشركة الإيطالية للطاقة.
D339	كما ادعى بأن قانون التأميم الإيطالي تعارضَ مع معاهدة روما، وطالب بمرجعية يتم الإدلاء بها إلى كل من المحكمة الدستورية الإيطالية ومحكمة العدل طبقاً للفصل 267 من معاهدة تشكيل الاتحاد الأوروبي.
D340	وأدلت المحكمة الدستورية الإيطالية أنه بسبب كون قانون التأميم مؤرَّخ سنة 1962، وأن المعاهدة قد دخلت حيز التنفيذ منذ سنة 1958، فقد كان ادعاء كوستا باطلا.
D341	وفي المقابل، قررت محكمة العدل أن معاهدة روما أساساً قد منعت بشكل قطعي تأميم الطاقة، ولم يكن بوسع السيد كوستا رفع دعوى، بل طبقاً لبنود المعاهدة فقد كانت المفوضية الأوروبية فقط مخوّلةً بفعل هذا في أي حال من الأحوال.
D342	أما تطبيقيا، فقد كان السيد كوستا مخوّلا بالمرافعة بأن المعاهدة تتعارض مع القانون القوم، وأن كان ليتوجب على المحكمة التفكير في ادعاءه حتى تقوم بعمل مرجعية في حالة عدم صدور أي استئناف بخصوص هذا القرار.
D343	وقد أعادت محكمة العدل صياغة فكرتها في فان جيندن لووس، وهي أن الدول الأعضاء "وعلى الرغم من كونها محدودة الصلاحيات، فإن لها حقوقا سيادية محدودة وقد سنّت قوانين متلائمة معها ومع مواطنيها" على "أساس التبادل".
D344	فالقانون الأوروبي "لن يُتجاوز بالبنود القانونية المحلية حتى وإن كانت مُصاغةً...
D345	دونما أساس قانوني نظراً لكون المجموعة بأسرها محطّ التساؤلات."
D346	هذا عنى أن أيّ "تصرف أحادي الجانب يعقب هذا الأمر" من قبل الدول الأعضاء هو تصرّف غير ملائم.
D347	وكذلك الأمر بالنسبة لإدارة المالية الإيطالية بشأن شركة سيمنتال سبا، حيث رفعت شركة سيمنتال سبا دعوى حول كون رسوم الفحوصات الصحية المطابقة للقانون الإيطالي المؤرخ سنة 1970 بشأن توريد لحوم البقر من فرنسا إلى إيطاليا متناقضة مع قانونين لسنتي 1964 و1968.
D348	و "تماشياً مع مبدأ أسبقية قانون الجماعات،" فإن "الإجراءات الهياكل ذات القابلية المباشرة للتطبيق" (كالقوانين التي تخص الحالة) "تجعل أي بنود متعارضة مع القانون الوطني الراهن غير قابلة للتطبيق بشكل آلي."
D349	وقد كان هذا بالضرورة ليحول دون "الإنكار المتراسل لتحمّلات" المعاهدة "التي تتولاها الدول الأعضاء دون شروط وبشكل نهائي"، والتي قد "تعرض جوهر" الاتحاد الأوروبي "للخطر".
D350	لكنه على الرغم من أن وجهة نظر محكمة العدل، فإن المحاكمة الوطنية لكل الدول الأعضاء لم تقبل بنفس التحليل.
D351	لا توجد معاهدة واحدة أصلية من التي أسّست الاتحاد الأوروبي تتحدث عن حماية الحقوق الأساسية.
D352	لم يكن هناك تصوّر أن تدابير الاتحاد الأوروبي، أي أعمال مؤسسات الاتحاد الأوروبي التشريعية والإدارية، أن تخضع لحقوق الإنسان.
D353	في ذلك الوقت كان الهم الوحيد هو منع الدول الأعضاء من انتهاك حقوق الإنسان، وبالتالي إبرام المعاهدة الأوروبية لحقوق الإنسان في سنة 1950 ثم إحداث المحكمة الأوروبية لحقوق الإنسان.
D354	وقد أقرّت محكمة العدل الأوروبية بأن الحقوق الأساسية هي المبدأ الرئيسي لقانون الاتحاد الأوروبي نظراً لأن الحاجة لضمان تناسبية تدابير الاتحاد الأوروبي مع حقوق الإنسان المضمّنة بدساتير الدول الأعضاء قد صارت جلية أكثر.
D355	في سنة 1999 قام المجلس الأوروبي بإنشاء هيئة مكلّفة كتابة مسودّة للدستور الأوروبي لحقوق الإنسان الذي يمكن أن يشكل الركيزة الدستورية للاتحاد الأوروبي إذ هذا ما يوصى بتطبيقه خصوصاً للاتحاد الأوروبي ومؤسساته.
D356	ويتضمن دستور الاتحاد الأوروبي لحقوق الإنسان الأساسية قائمةً للحقوق الأساسية من المعاهدة الأوروبية بشأن حقوق الإنسان الأساسية والحرية، ومن الإعلان العالمي لحقوق الإنسان الصادر عن البرلمان الأوروبي سنة 1989 ومن معاهدات الاتحاد الأوروبي.
D357	بعد انتخاب حزب العمال البريطاني بالحكومة في سنة 1997، شاركت المملكة المتحدة رسمياً في الاتفاق حول السياسة الاجتماعية، والتي سمحت لها بأن تكون مضمّنة في التنقيحات الطفيفة مثل الفصل الاجتماعي لمعاهدة أمستردام المؤرخة سنة 1997.
D358	بعد ذلك تبنّت المملكة المتحدة التشريع الرئيسي المتّفق عليه سابقاً طبقاً للاتفاقية في السياسة الاجتماعية، وعلى توجيهية أشغال المجلس والتي تستلزم استشارات الطاقة العمالية في الأعمال والمنحة الأبوية التوجيهية لسنة 1996.
D359	خلال الأعوام العشرة التي تلت معاهدة أمستردام سنة 1997 وتبنّي الفصل الاجتماعي، قام الاتحاد الأوروبي بتولّي تقديم المبادرات على أصعدة مختلفة من السياسة الاجتماعية، بما في ذلك العمل والعلاقات بين الصناعات وتكافؤ الفرص والأمن والصحة العمومية وحماية الأطفال والمعاقين والعجّز والفقر والعمال المهاجرون والتعليم والتكوين والشباب.
D360	إن غابة الأمازون المطيرة (بالبتغالية:  Floresta Amazônicaأو Amazônia، وبالإسبانية: Selva Amazónica، أو Amazonía أو عادةً ما تكون Amazonia، وبالفرنسية: Forêt amazonienne، وبالألمانية: Amazoneregenwoud)، كما تعرف أيضاً بالإنقليزية بــAmazonia أو غابة الأمازون، هي غابة رطبة ذات غطاء نباتي كثيف يغطي معظم حوض الأمازون بأمريكا الجنوبية.
D361	يغطي هذا الحوض 7,000,000 كيلومتراً مربّعاً (2.70 ميلا مربعا)، منها 5,500,000 كيلومتراً مربّعاً تغطيها الغابة المطيرة.
D362	وتتضمن هذه المنطقة أراضٍ تابعة لـ تسع دول.
D363	وتقع جل الغابة المطيرة في داخل البرازيل بنسبة 60%، تليها البرو بنسبة 13%، وكولوبيا بنسبة 10%، ثم بنسب صغيرة في فنزويلا والإيكوادور، وبوليلفيا، وغيانا وسورينيم، وغيانا الفرنسية.
D364	ثمة ولايات أو أقسام في أربع دول تحمل عبارة "أمازون" بأسمائها.
D365	يمثل الأمازون أكثر من نصف غابات الكوكب المتبقّية، وهو المكان تنوعاً بيولوجيّاً وأكبر غابة مطيرة استوائية في العالم، بعدد أشجار يقدّر ب 390 بليون شجرة تنقسم إلى 16,000 نوعاً.
D366	ما بين سنتي 1991 و2000 كانت المنطقة الغابية من الأمازون تتضاءل الذي ازداد من 415,000 إلى 587,000 كيلومتراً مربّعا (من 160000 إلى 227000 ميلا مربّعاً)، نظراً لأن معظم ما نقص من الغابة يتحول إلى مراعي للمواشي.
D367	صارت سبعون بالمائة من الأراضي المشجرة سابقاً و 91% من الأراضي التي أزيلت منها الغابات منذ سنة 1970 تستعمل لإطعام المواشي.
D368	تعدّ البرازيل حاليا ثاني أكبر منتج لفول الصويا بعد الولايات المتحدة.
D369	لكن بحثاً جديدا أجراه ليدمير أوليفيرا وغيره، بين أن هطل الأمطار في تلك المنطقة ينقص بقدر ما يزيد التركّز الغابيّ بالأمازون مما يعني أن الإنتاج النباتي بالهكتار يقل كذلك.
D370	فرغم شيوع هطل الأمطار بالبرازيل، فإن تركز الغابات المطرية وتحويلها إلى حقول رعوية لم يمنحها أفضلية اقتصادية
D371	لطالما كانت الحاجة إلى فلاحي الصويا تستعمل كتعلّة للعديد من مشاريع النقل المثيرة للجدل والآخذة في التطور في الأمازون.
D372	قامت الطريقين السريعتين جعل الغابة المطرية متفتحةً وأدّت إلى زيادة في المساكن وإزالة الغابات.
D373	وأقل نسبة إزالة للغابات في السنة منذ سنة 2000 وحتى سنة 2005 (22.392 كيلومترا مربّعا أو 8.646 ميلاً مربّعاً سنويّأ) كانت أعلى بنسبة 18% من السنوات الخمس الماضية (19.018 كيلومترا مربّعا أو 7.343 ميلاً مربّعاً سنوياّ).
D374	رغم أن إزالة الغابات تراجعت بشكل كبير بمنطقة الأمازون البرازيلية ما بين سنتي 2004 و2014، إلا أنا ما فتئت تزداد حتى هذا اليوم.
D375	يشعر أخصائيو البيئة والمحيط بالقلق إزاء فقدانالتنوع البيولوجي الذي سينجر عنه تدمير الغابة، وكذلك إزاء انبعاث غاز الكربون المحفوظ بالنباتات، مما يزيد في وتيرة الانحباس الحراري.
D376	تمثّل غابات الأمازون دائمة الخضرة حوالي 10% من إنتاجية العالم الأولية، و 10% من مخازن غاز الكربون في الأنظمة البيئية ــــ بما يقدّر بـ 1.1 × 1011 طَنّاً متريّاً من الكربون.
D377	ويقدّر معدل اختزان غابات الأمازون للكربون 0.62 ± 0.37 طنا من غاز الكربون في كل هكتار سنويّا ما بين سنتي 1975 و1996.
D378	في سنة 2010 شهدت غابة الأمازون المطرية جفافاً شديداً وكان بطريقة ما أشد من جفاف سنة 2005.
D379	وتقدّر المنطقة المتضررة من الغابة المطيرة بحوالي 1,160,000 ميلا مربّعا (3,000,000 كيلومتراً مربعاً) مقارنةً بــ734,000 ميلا مربعاً (1,900,000 كيلومتراً) سنة 2005.
D380	كان لجفاف سنة 2010 ثلاثة مراكز سطحية حيث ماتت النباتات، في حين تركز الجفاف في سنة 2005 بالجزء الجنوبي الغربي.
D381	تم نشر نتائج الأبحاث في مجلة العلوم.
D382	يمتص الأمازون في السنة العادية 1.5 مليار طن من ثاني أكسيد الكربون، غير أنه انبعثت 5 مليارات طن سنة 2005 و8 مليار طن سنة 2010.
D383	تُعَدّ كل المشطيات تقريباً ضارية، فهي تقتات على فرائس متنوعة من اليرقات المجهرية إلى الحيوانات الدولابية، وحتى القشريات الصغيرة البالغة، أما الاستثناءات فهي نوعين ناشئين يعيشان كفطريات على السالبيات التي تقتات عليها الأنواع البالغة منها.
D384	يمكن للمشطيات في أفضل الظروف أن تأكل عشرة أضعاف وزنها في اليوم.
D385	وقدتم التعريف فقط 100-150 نوعا، هناك تقريبا 25 نوعا آخر لم يتم تعريفه وتسميته.
D386	ومن أمثلة مشطيات البحر الموجودة في الكتاب هناك ذوات الجسم البيضاوي وع زوج من المجسات القابلة للانكماش وهي تهدّبها المويجسات ("مجسّات صغيرة") تغطيها مولدات المادة الغروية، وهي خلايا تلتصق بالفريسة لتثبيتها.
D387	أما الشعبة فبها العديد من الأشكال البدنية مثل نوغ بليتيتسنيدا المسطّحة والكائنة في أعماق البحر، ويفتقر البالغون من هذا النوع إلى الثقوب، نوع البروادا التي ليس لها مجسات وتقتات على المشطيات الأخرى باستعمال فم كبير مزود بمجموعة من الأهداب المتصلبة التي تعمل عمل الأسنان.
D388	وتمكن هذا الاختلافات الأنواع المتعددة من التكاثر بشكل كبير وفي نفس المنطقة، فلكل من هذه الأنواع فرائس مختلفة والتي تختلف طريقة صيدها كاختلاف طريقة صيد العناكب لفرائسها.
D389	تم العثور على مستحثات أثرية في المرسب الأحفوري يعتقد بأنها لمشطيات ذات أجسام ناعمة وهلامية، تبدو بلا مجسّأت بل لها من أهداب مصطفة أكثر مما في الأشكال الحديثة، وتعود إلى أوائل العصر الكمبري منذ حوالي 515 مليون سنة.
D390	لطالما كان موضع المشطينات في تطور شجرة العائلة محلاً للنقاش، وباعتماد علم الوراثة العرفي الجزيئي، فإن وجهة نظر الأغلبية هي أن اللواسع وثنائيات التناظر لهما ارتباط وثيق بعضهما يزيد عن ارتباطهما بالمشطيات.
D391	وقد استنتج تحليل وراثي جزيئي أن أصل جميع المشطيات الحديثة كان مشابها للمشطيات، وأن كل المجموعات العصرية وجدت ربّما بعد انقراض العصر الطباشيري الثلاثي منذ 66 مليون سنة خلت.
D392	تشير الأدلة التي جُمعَت منذ ثمانينات القرن الماضي إلى أن "المشطيات" ليست أحادية الأرومة، أي لا تتضمن سليلات كاملة ووحيدة لنوع رئيسي مشترك، لأن كل المجموعات الأخرى للمشطيات تنحدر من حيوانات مشطية أخرى
D393	بحجمها البالغ 1 مليمتر (0.039 إنش) إلى 1.5 متراً (4.9 قدماً)، تعتبر المشطيات أكبر الأحياء التي لا تعيش ضمن مستعمرات والتي تستعمل الأهداب طريقةً للتنقل.
D394	ولدى أغلب الأنواع ثمانية أهداب تسمى بأسنان المشط، تمتد على طول أجسامها وتحمل أحزمة من الأهداب تشبه أسنان المشط تسمى "الأمشاط" التي تتجمّع حول أسنان المشط حتى إذا تحركت الأهداب، تملس كل سن السن الني تحتها.
D395	أما اسم "المشطيات" فيعني "ذوات الأمشاط"، يوناني الأصل κτείς (من جذر κτεν-) الذي يعني "المشط" ومن عبارة –φορος التي تعني "الحمل".
D396	تعد المشطيات من الفصائل النادرة جدا بسبب أجسادها الناعمة والهلامية، والتي تم تفسيرها على أنها مشطيات، وقد عُثِرَ على هذه المستحثات في المراسب الأحفورية وهي الأماكن التي تكون البيئة فيها مناسبةً لحفظ نعومة الأنسجة.
D397	فحتى التسعينيات لم يعثر إلا على هذين النموذجين الجيدين بما يكفي للتحليل، وكلاهما من المجموعة الملكية، أي من أوائل الفترة الديفونية (الإمسية).
D398	ثم وجدت ثلاثة أنواع أخرى مشكوك فيها في صخور بورجس الصلصالية وفي الصخور الكندية بنفس العمر، أي منذ حوالي 505 مليون سنة خلت من أواسط العصر الكامبري.
D399	ولم تمتلك أي من الثلاثة المجسّات لكن كان لديها ما بين 24 و80 سنا مشطيا، وهو أكثر بكثير من الأنواع الحية ذوت 8 أسنان مشطية.
D400	كما بدو أن لهم تركيبات داخلية تشبه الأعضاء على عكس ما وُجِد في المشطيات الحية.
